{
  "schema_version": "1.0",
  "id": "G7",
  "name": "Camera-based deck activity monitor",
  "source": {
    "document": "Team-defined Logitech BRIO 101 + Snapdragon/Dragonwing Scenario D prototype: CPU OpenCV on Dell Snapdragon X Elite, with future Dragonwing transfer unverified; not an Annex B guest.",
    "guest_card": "G7",
    "assumptions_added": [
      "All power, mass, placement, bandwidth, compute and installation values are Scenario D demonstration assumptions, not verified hardware figures.",
      "Monitoring 0.040 kW and alerting 0.065 kW are illustrative system load reservations, not the BRIO 101's measured USB draw.",
      "1.2 kg represents a hypothetical onboard camera and mounting enclosure, not the Dell laptop.",
      "G7 is a ship-side perimeter camera simulation; live video is processed separately on the Dell workstation.",
      "0.02 Mbit/s reserves detection metadata only; raw camera video is not transmitted on the simulated ship backbone.",
      "One crew member and 30 minutes for port installation remain unverified demo assumptions."
    ]
  },
  "capability": {
    "description": "Watches a designated perimeter-surveillance region for unclassified motion candidates; publishes advisory signals to Scenario D, separate from flight-deck clearance.",
    "value_by_mission": {
      "rescue": "medium",
      "patrol": "medium",
      "survey": "low",
      "disaster_relief": "medium",
      "default": "low"
    }
  },
  "criticality": {
    "safety_critical": false,
    "mission_criticality": "resolved_from_external_mission_priority_file"
  },
  "assembly": {
    "atomic_for_admission_and_shedding": true,
    "components": [
      {
        "id": "deck_camera_pod",
        "name": "Camera and hypothetical mast mounting",
        "mass_kg": 1.2,
        "footprint_m2": 0.05
      }
    ],
    "requires": [],
    "excludes": []
  },
  "placement": {
    "configurations": [
      {
        "id": "mast_camera",
        "preferred": true,
        "assignments": [
          {
            "component_id": "deck_camera_pod",
            "location": "mast_slot",
            "bay_fraction": null,
            "area_m2": 0.05
          }
        ],
        "requirements": [],
        "notes": "Hypothetical use of the one free mast slot; may compete with G1/G5. Physical mounting is not verified."
      }
    ]
  },
  "resources": {
    "power_modes": [
      {
        "id": "active",
        "power_kw": {
          "min": null,
          "nominal": 0.04,
          "peak": null
        },
        "max_duration_minutes": null,
        "interruptible": true,
        "capability_fraction": 1,
        "notes": "Scenario D monitoring: synthetic 0.040 kW continuous load."
      },
      {
        "id": "alert",
        "power_kw": {
          "min": null,
          "nominal": 0.065,
          "peak": null
        },
        "max_duration_minutes": null,
        "interruptible": true,
        "capability_fraction": 1,
        "notes": "Scenario D alert: synthetic 0.065 kW continuous load while an observation is active."
      }
    ],
    "cooling": {
      "type": "air",
      "electrical_kw_to_heat_kw": 1,
      "chilled_water_load_rule": "not_on_chilled_water_loop",
      "notes": "Hypothetical mast air cooling; 1:1 electrical-to-heat convention."
    },
    "data_links": [
      {
        "type": "backbone",
        "bandwidth_mbps": {
          "min": null,
          "nominal": 0.02,
          "max": null
        },
        "disabled_in_emission_silence": false,
        "notes": "Scenario D metadata events only, 0.02 Mbps assumed; no raw video transmitted."
      }
    ],
    "compute": {
      "cpu_cores": null,
      "ram_gb": null,
      "accelerator_units": null,
      "storage_gb": null
    },
    "response_time": {
      "max_processing_latency_ms": null
    }
  },
  "operational_modes": [
    {
      "id": "observing",
      "power_mode_id": "active",
      "requirements": [],
      "conflicts": [],
      "notes": "Observes a perimeter region independent of G4's launch deck. No motion does not certify safety."
    },
    {
      "id": "alerting",
      "power_mode_id": "alert",
      "requirements": [],
      "conflicts": [],
      "notes": "Unclassified motion alert; two positive observations are required by Scenario D before automated simulated G4 startup."
    }
  ],
  "installation": [
    {
      "operation": "install_component",
      "component_ids": [
        "deck_camera_pod"
      ],
      "port_only": true,
      "crew_required": 1,
      "duration_minutes": 30,
      "at_sea_window": null,
      "notes": "Hypothetical one-person 30-minute port-only install for solver demonstration; not a real installation certificate."
    }
  ],
  "special_events": [],
  "policy_hints": [
    "G7 is perimeter surveillance only; never infer independent flight-deck clearance.",
    "Require two consecutive valid positive observations before simulated G4 power-up.",
    "Camera loss or stale data is UNKNOWN; never substitute it for operator launch authorization.",
    "Only automatically start a software simulation of G4 power-up; no hardware start/launch commands."
  ],
  "documented_unknowns": [
    "Actual electrical draw, environmental reliability, mass, mounting and end-to-end camera latency are unverified.",
    "The motion detector has no object classifier, person identification or certified intrusion detection; an unclassified candidate is not an identified object.",
    "Actual hardware interface for Qualcomm Dragonwing and physical drone commands are not implemented.",
    "Flight-deck safety requires separate verified checks; perimeter detection cannot validate takeoff conditions."
  ],
  "notes": [
    "User-defined G7 with new Scenario D synthetic values; camera prototype runs on Dell Snapdragon X Elite.",
    "Scenario D responds to motion, not a certified AI object classification; NPU deployment is optional future work.",
    "All simulated launches require an independent deck verification and explicit software operator authorization."
  ]
}
