{
  "schema_version": "1.0",
  "id": "G1",
  "name": "Passive radio sensor",
  "source": {
    "document": "Fincantieri Software-Defined Vessel SHORT, Technical Annex B (guest cards) and B.0 (ontology); Annex A (host-wide conditions)",
    "guest_card": "G1",
    "assumptions_added": []
  },
  "capability": {
    "description": "Detects non-identifying transmitting vessels.",
    "value_by_mission": {
      "patrol": "high",
      "survey": "low",
      "rescue": null,
      "disaster_relief": null,
      "default": null
    }
  },
  "criticality": {
    "safety_critical": false,
    "mission_criticality": "resolved_from_external_mission_priority_file"
  },
  "assembly": {
    "atomic_for_admission_and_shedding": true,
    "components": [
      {
        "id": "radio_sensor",
        "name": "Passive radio sensor",
        "mass_kg": 45,
        "footprint_m2": 0.5
      }
    ],
    "requires": [],
    "excludes": [
      {
        "type": "shared_location_contention",
        "other_guest": "G5",
        "other_component": "antenna",
        "condition": "Both demand a scarce mast slot; alternative roof placement for G5 may resolve it."
      }
    ]
  },
  "placement": {
    "configurations": [
      {
        "id": "mast",
        "preferred": true,
        "assignments": [
          {
            "component_id": "radio_sensor",
            "location": "mast_slot",
            "bay_fraction": null,
            "area_m2": 0.5
          }
        ],
        "requirements": [],
        "notes": "Only one of three mast positions is initially free; competes with G5 antenna."
      }
    ]
  },
  "resources": {
    "power_modes": [
      {
        "id": "active",
        "power_kw": {
          "min": null,
          "nominal": 1.5,
          "peak": null
        },
        "max_duration_minutes": null,
        "interruptible": null,
        "capability_fraction": null,
        "notes": "Continuous; air-cooled."
      }
    ],
    "cooling": {
      "type": "air",
      "electrical_kw_to_heat_kw": 1.0,
      "chilled_water_load_rule": "not_on_chilled_water_loop",
      "notes": "Electrical load converts to heat at 1:1 per Annex A.2. Air-cooled mast guests cannot use a chilled-water manifold."
    },
    "data_links": [
      {
        "type": "backbone",
        "bandwidth_mbps": {
          "min": null,
          "nominal": 50,
          "max": null
        },
        "disabled_in_emission_silence": false,
        "notes": null
      },
      {
        "type": "shore_link_transport_unspecified",
        "bandwidth_mbps": {
          "min": null,
          "nominal": 0.2,
          "max": null
        },
        "disabled_in_emission_silence": true,
        "notes": "200 kbit/s shore demand. Transport is not specified; passive sensing itself remains compatible with silence."
      }
    ],
    "compute": {
      "cpu_cores": null,
      "ram_gb": null,
      "accelerator_units": null,
      "storage_gb": null
    },
    "response_time": {
      "max_processing_latency_ms": null
    }
  },
  "operational_modes": [
    {
      "id": "passive_sensing",
      "requirements": [],
      "conflicts": [],
      "notes": "No course or speed restrictions. Passive sensing remains available in emission silence."
    }
  ],
  "installation": [
    {
      "component_ids": [
        "radio_sensor"
      ],
      "port_only": true,
      "crew_required": 2,
      "duration_minutes": 180,
      "at_sea_window": null,
      "notes": "Port only."
    }
  ],
  "special_events": [
    {
      "type": "capability_modifier",
      "trigger": {
        "field": "platform.own_radar_transmitting_nearby",
        "operator": "eq",
        "value": true,
        "reason": null
      },
      "capability_loss_fraction": 0.3,
      "notes": "Annex B offers an alternative implementation of a quiet-radio operating rule."
    }
  ],
  "policy_hints": [],
  "documented_unknowns": [
    "Minimum/peak draw and per-guest compute/response-time needs not specified.",
    "Physical transport for the 200 kbit/s shore link is not specified."
  ],
  "notes": []
}